direction,post,salary,research_direction,introduction,model,hot
Recommendation algorithm,Recommended Algorithm Engineer,35.6k,Knowledge based recommendation,"TF-IDF stands for Term Frequency-Inverse Document Frequency. It's a numerical statistic used to reflect the importance of a word in a document relative to a collection of documents, often used in natural language processing and information retrieval.A Knowledge Graph is a structured representation of knowledge, typically in the form of a graph, where entities (such as people, places, or things) are represented as nodes, and the relationships between these entities are represented as edges. Knowledge Graphs are designed to capture and organize knowledge in a way that is easily understandable by both humans and machines. Here's a breakdown of key components and characteristics:
Entities: Entities represent real-world objects or concepts, such as people, organizations, locations, events, or abstract concepts. Each entity is typically represented as a node in the graph.
Relationships: Relationships define connections between entities and describe how they are related to each other. Relationships are represented as edges between nodes in the graph and can have properties or attributes associated with them.
Properties: Properties provide additional information about entities or relationships. They can include attributes such as names, descriptions, dates, or numerical values.
Ontologies and Schemas: Knowledge Graphs often incorporate ontologies or schemas to define the types of entities and relationships that can exist in the graph, as well as their properties and constraints. These ontologies provide a structured framework for organizing and categorizing knowledge.
Linked Data: Knowledge Graphs are often based on the principles of Linked Data, which emphasize the use of standardized identifiers (such as URIs) and open standards (such as RDF and SPARQL) to enable interoperability and integration of data from different sources.
Semantic Reasoning: Knowledge Graphs can support semantic reasoning and inference, allowing for the discovery of new knowledge or the validation of existing knowledge based on logical rules or constraints defined in the ontology.
Applications: Knowledge Graphs have numerous applications across various domains, including search engines (such as Google's Knowledge Graph), recommendation systems, question answering systems, data integration, natural language understanding, and semantic web technologies.",Knowledge Graph,21.3
Recommendation algorithm,Recommended Algorithm Engineer,35.6k,Hybrid recommendation,A Weighted Hybrid Model is a type of recommendation system that combines multiple recommendation algorithms or models by assigning weights to each algorithm's predictions and aggregating them to generate final recommendations.,Weighted Hybrid Model,20.1
Recommendation algorithm,Recommended Algorithm Engineer,35.6k,Hybrid recommendation,The Cascade Hybrid Model is a type of recommendation system that sequentially combines the outputs of multiple recommendation algorithms or models in a cascading fashion to generate final recommendations,Cascade Hybrid Model,20.1
Recommendation algorithm,Recommended Algorithm Engineer,35.6k,Content based recommendation,"Word Embedding is a technique used in natural language processing (NLP) to represent words as dense vectors of real numbers, typically in a high-dimensional space. Word embeddings capture semantic and syntactic similarities between words, enabling machines to understand and process human language more effectively. ",Word Embedding,51.4
Recommendation algorithm,Recommended Algorithm Engineer,35.6k,Collaborative filtering recommendation,Item-Item Collaborative Filtering recommends items to users based on the similarity between items. It identifies items that are similar to the ones a user has liked or interacted with and recommends those similar items.,Item-Item Collaborative Filtering,13.9
