direction,post,salary,research_direction,introduction,model,hot
NLP,Natural Language Processing Engineer-LLM,38.5K,LLM,"  Short for Generative Pre-trained Transformer, is a state-of-the-art deep learning model developed by OpenAI. It belongs to the category of transformer models, which have revolutionized natural language processing (NLP) tasks due to their ability to capture long-range dependencies in sequential data.
  The architecture of GPT consists of multiple layers of self-attention mechanisms and feedforward neural networks. Self-attention allows the model to weigh the importance of each word in a sequence when processing it, enabling it to consider contextual information effectively. This architecture makes GPT capable of understanding and generating human-like text with remarkable coherence and fluency. 
  GPT is pre-trained on vast amounts of text data using unsupervised learning techniques, where it learns to predict the next word in a sequence given the preceding context. This pre-training phase enables GPT to acquire a broad understanding of language patterns and structures, making it adaptable to various downstream NLP tasks.
  One of the distinguishing features of GPT is its generative capability. Given a prompt or an initial sequence of text, GPT can generate coherent and contextually relevant continuations, making it suitable for applications such as text completion, text summarization, and dialogue generation.
  Furthermore, GPT can be fine-tuned on specific datasets or tasks with supervised learning, allowing it to achieve even better performance on tasks like sentiment analysis, language translation, and question answering.
  Overall, GPT has demonstrated remarkable versatility and effectiveness across a wide range of natural language understanding and generation tasks, solidifying its position as one of the most powerful and influential models in the field of deep learning and NLP.",GPT,16
NLP,Natural Language Processing Engineer-LLM,38.5K,LLM,"   BERT, short for Bidirectional Encoder Representations from Transformers, is a cutting-edge deep learning model developed by Google. It represents a significant advancement in natural language processing (NLP) by leveraging bidirectional context in pre-training.
   The architecture of BERT is based on the transformer model, which has proven highly effective in capturing long-range dependencies in sequential data.    However, unlike traditional transformer models, BERT employs a bidirectional approach during pre-training. This means that during the pre-training phase,  BERT can analyze both preceding and following words in a sentence to better understand the context in which each word appears.
   BERT's pre-training is conducted on large corpora of text data using unsupervised learning techniques. During pre-training, the model learns to predict missing words within a sentence based on the surrounding context. This process allows BERT to develop a deep understanding of the nuances and semantics of natural language.
  One of the key innovations of BERT is its use of masked language modeling (MLM) during pre-training. In MLM, a certain percentage of words in each input sentence are randomly masked, and the model is tasked with predicting these masked words based on the remaining context. This technique encourages the model to learn contextual representations that are robust and generalize well to various downstream NLP tasks.
   BERT's bidirectional nature and deep contextual understanding make it highly versatile and applicable to a wide range of NLP tasks. After pre-training, BERT can be fine-tuned on specific tasks using supervised learning, achieving state-of-the-art performance on tasks such as text classification, named entity recognition, question answering, and sentiment analysis.
   In summary, BERT has significantly advanced the field of natural language processing by introducing a bidirectional approach to pre-training, enabling it to capture rich contextual information and achieve remarkable performance across various NLP tasks.",BERT,16
NLP,Natural Language Processing Engineer-LLM,38.5K,LLM,"   XLNet stands for ""eXtreme Learning Net,"" and it represents a state-of-the-art deep learning model in the field of natural language processing (NLP), developed by researchers at Google AI and Carnegie Mellon University. It builds upon the transformer architecture and incorporates several novel techniques to improve language understanding and generation tasks.
   The key innovation of XLNet lies in its use of a permutation-based language modeling objective during pre-training. Unlike previous models like BERT, which use masked language modeling (MLM), XLNet considers all permutations of the input sequence during pre-training. This approach allows the model to learn bidirectional context without needing to mask any tokens, thereby overcoming the limitations of left-to-right or right-to-left pre-training strategies.
   XLNet's pre-training objective, called permutation language modeling (PLM), requires the model to predict the order of words in a sequence given all possible permutations. By learning from various permutations, XLNet effectively captures bidirectional context and dependencies within the input sequence, leading to more robust and contextually aware representations.
   Additionally, XLNet introduces a novel autoregressive mechanism called autoregressive permutation language modeling (APLM). APLM leverages the advantages of both autoregressive and permutation language modeling, enabling XLNet to capture bidirectional context while maintaining the autoregressive property that allows for efficient generation of text.",XLNet,16
NLP,Natural Language Processing Engineer,24.6K,Text generation,"    The Transformer model is a groundbreaking architecture in the field of natural language processing (NLP), introduced by researchers at Google in the paper ""Attention is All You Need."" It represents a departure from traditional recurrent neural network (RNN) and convolutional neural network (CNN) architectures by relying solely on self-attention mechanisms for modeling dependencies between input and output tokens.
    At its core, the Transformer model consists of an encoder-decoder architecture, with each component comprising multiple layers of self-attention and feedforward neural networks. The self-attention mechanism allows the model to weigh the importance of each token in the input sequence when generating an output sequence, enabling it to capture long-range dependencies more effectively than RNNs or CNNs.
     One of the key advantages of the Transformer model is its parallelizability. Unlike RNNs, which process input sequences sequentially, the self-attention mechanism in Transformers allows for parallel computation across all tokens in the sequence. This makes Transformers highly efficient and scalable, particularly for tasks involving long sequences of text.
      Another notable feature of the Transformer model is its attention mechanism, which enables the model to attend to different parts of the input sequence at each layer. This mechanism allows Transformers to capture both local and global dependencies within the input sequence, leading to more robust and contextually aware representations.
       The Transformer architecture has been widely adopted and adapted for various NLP tasks, including machine translation, text summarization, and language modeling. Models like BERT, GPT, and XLNet are all based on the Transformer architecture and have achieved state-of-the-art results on numerous benchmarks and competitions.",Transformer,20
NLP,Natural Language Processing Engineer,24.6K,Text generation,"  Short for Generative Pre-trained Transformer, is a state-of-the-art deep learning model developed by OpenAI. It belongs to the category of transformer models, which have revolutionized natural language processing (NLP) tasks due to their ability to capture long-range dependencies in sequential data.
  The architecture of GPT consists of multiple layers of self-attention mechanisms and feedforward neural networks. Self-attention allows the model to weigh the importance of each word in a sequence when processing it, enabling it to consider contextual information effectively. This architecture makes GPT capable of understanding and generating human-like text with remarkable coherence and fluency. 
  GPT is pre-trained on vast amounts of text data using unsupervised learning techniques, where it learns to predict the next word in a sequence given the preceding context. This pre-training phase enables GPT to acquire a broad understanding of language patterns and structures, making it adaptable to various downstream NLP tasks.
  One of the distinguishing features of GPT is its generative capability. Given a prompt or an initial sequence of text, GPT can generate coherent and contextually relevant continuations, making it suitable for applications such as text completion, text summarization, and dialogue generation.
  Furthermore, GPT can be fine-tuned on specific datasets or tasks with supervised learning, allowing it to achieve even better performance on tasks like sentiment analysis, language translation, and question answering.
  Overall, GPT has demonstrated remarkable versatility and effectiveness across a wide range of natural language understanding and generation tasks, solidifying its position as one of the most powerful and influential models in the field of deep learning and NLP.",GPT,19.9
NLP,Natural Language Processing Engineer,24.6K,Text generation,"The Variational Autoencoder (VAE) is a type of generative model in the field of machine learning that aims to learn a low-dimensional representation of input data in an unsupervised manner. It is based on the principles of both autoencoders and variational inference
The VAE consists of two main components: an encoder and a decoder. The encoder takes the input data and maps it to a latent space, where each point represents a compressed representation of the input. The decoder then takes samples from this latent space and reconstructs the original input data.
What sets the VAE apart from traditional autoencoders is its use of probabilistic latent variables. Instead of directly mapping input data to a fixed latent representation, the VAE learns a probability distribution over the latent space. This distribution is typically Gaussian, with a mean and variance for each dimension of the latent space.
During training, the VAE learns to maximize the likelihood of generating the input data while simultaneously minimizing the discrepancy between the learned latent distribution and a predefined prior distribution (usually a standard Gaussian). This is achieved by minimizing a loss function that consists of two components: the reconstruction loss, which measures how well the decoder reconstructs the input data, and the KL divergence, which measures the difference between the learned latent distribution and the prior distribution.
The VAE has several applications in machine learning, including data generation, dimensionality reduction, and representation learning. By learning a meaningful latent space representation of the input data, VAEs can generate new data samples that resemble the training data distribution, interpolate between existing data points, and perform various other tasks that require understanding the underlying structure of the data.",VAE,19.9
NLP,Natural Language Processing Engineer,24.6K,Text generation,"Model structure: The Llama model adopts a Transformer based architecture, which is a deep neural network structure composed of multiple self attention mechanisms and feedforward neural networks. The Transformer architecture captures dependency relationships in input sequences through self attention mechanisms, enabling the model to understand and generate complex natural language texts. The Llama model has been extended on the basis of Transformer, with deeper network layers and larger parameter scales. This enables the model to learn more language knowledge and patterns, thereby exhibiting higher performance in handling complex NLP tasks.
Training process: The training process of Llama model is mainly divided into two stages: pre training and fine-tuning.",llama,20
CV,Computer vision engineer,32.5K,Object detection,"Convolutional Neural Networks (CNNs) are a class of deep neural networks primarily used for analyzing visual imagery. They are highly effective in tasks such as image classification, object detection, and image segmentation. CNNs are inspired by the organization of the animal visual cortex, where neurons respond to stimuli only within a limited receptive field, allowing them to detect hierarchical patterns.
CNNs consist of several layers, including convolutional layers, pooling layers, and fully connected layers. Convolutional layers are the core building blocks of CNNs, responsible for extracting features from the input data. Each convolutional layer applies a set of learnable filters (also called kernels) to the input image, convolving it to produce feature maps. These filters detect various patterns such as edges, textures, and shapes.
Pooling layers are interspersed between convolutional layers and serve to reduce the spatial dimensions of the feature maps while retaining the most important information. Common pooling operations include max pooling and average pooling, which downsample the feature maps by selecting the maximum or average value within a local region.",CNN,20.2
CV,Computer vision engineer,32.5K,Object detection,"EfficientDet stands for ""Efficient Detection"". It is an object detection model that aims to achieve both accuracy and efficiency. EfficientDet is built on the EfficientNet backbone, which is a family of convolutional neural networks designed to be both accurate and efficient through the use of compound scaling techniques.
EfficientDet incorporates several key components to achieve its goals:
EfficientNet Backbone: The EfficientNet backbone provides a solid foundation for feature extraction, balancing accuracy and efficiency.
BiFPN (Bidirectional Feature Pyramid Network): EfficientDet utilizes a bidirectional feature pyramid network to fuse features from different levels of the backbone network. This allows the model to capture both high-level semantic information and low-level spatial details, which is crucial for accurate object detection.
Compound Scaling: EfficientDet employs compound scaling techniques to scale up the model in a balanced manner, increasing the depth, width, and resolution of the model simultaneously. This helps the model achieve better performance while maintaining efficiency.
EfficientDet has demonstrated state-of-the-art performance on various object detection datasets, while being more efficient than previous methods. It has become a popular choice for object detection tasks that require both accuracy and speed.",EfficientDet,20.2
CV,Computer vision engineer,32.5K,Object detection,"RetinaNet stands for ""Retina Network"". It is an object detection algorithm that was introduced in 2017 by Tsung-Yi Lin, Priya Goyal, Ross Girshick, Kaiming He, and Piotr Doll. RetinaNet aims to address the class imbalance problem in one-stage object detectors like YOLO and SSD, which tend to produce a large number of background examples during training.
To address this issue, RetinaNet introduces a novel loss function called Focal Loss, which down-weights the loss assigned to easy examples (i.e., background examples) and focuses on hard examples (i.e., objects of interest). This allows the model to better learn from positive examples and improve its performance on object detection tasks.
RetinaNet consists of a backbone network (such as ResNet) and two subnetworks: a classification subnet and a box regression subnet. The backbone network is used to extract features from the input image, while the classification subnet and box regression subnet are responsible for predicting the class labels and bounding box coordinates for each object in the image.
Overall, RetinaNet provides an effective and efficient solution for object detection tasks, achieving state-of-the-art performance on various benchmarks while being more efficient than previous methods.",RetinaNet,20.2
CV,Computer vision engineer,32.5K,Object detection,"Faster R-CNN stands for ""Faster Region-based Convolutional Neural Network"". It is an object detection algorithm that was introduced in 2015 by Shaoqing Ren, Kaiming He, Ross Girshick, and Jian Sun. Faster R-CNN aims to improve the speed and accuracy of previous region-based convolutional neural network (R-CNN) object detectors, such as R-CNN and Fast R-CNN.
Faster R-CNN introduces a novel region proposal network (RPN) that shares convolutional features with the detection network. The RPN is responsible for generating region proposals, which are potential bounding boxes that may contain objects of interest. The RPN is trained end-to-end with the detection network, enabling it to produce accurate region proposals efficiently.",Faster R-CNN,20.2
CV,Computer vision engineer,32.5K,image segmentation,"Mask R-CNN stands for ""Mask Region-based Convolutional Neural Network"". It is an extension of Faster R-CNN, a popular object detection algorithm, that adds the ability to generate a pixel-wise segmentation mask for each detected object instance.
Mask R-CNN consists of three main components:
Backbone Network: A pre-trained convolutional neural network (CNN), such as ResNet or VGG, is used as the backbone to extract feature maps from the input image.
Region Proposal Network (RPN): The RPN generates potential object proposals (bounding boxes) based on the feature maps. These proposals are then classified and refined to produce more accurate object detections.
Mask Branch: In addition to the classification and bounding box regression branches of Faster R-CNN, Mask R-CNN introduces a mask branch that takes the features from the region of interest (ROI) and generates a binary mask for each object instance. This mask indicates the pixel-wise segmentation of the object within its bounding box.",Mask R-CNN,24.8
CV,Computer vision engineer,32.5K,image segmentation,"Gated-SCNN stands for ""Gated Shape Convolutional Neural Network"". It is a deep learning model that was designed specifically for semantic segmentation tasks, with a focus on improving the ability to capture fine-grained shape information.
The key component of Gated-SCNN is the introduction of shape-aware gated convolution layers. These layers incorporate a shape-aware attention mechanism that allows the model to selectively attend to important shape cues within an image while ignoring less relevant information. This attention mechanism is achieved through the use of gates that control the flow of information through the network.
By incorporating shape-aware gated convolutions, Gated-SCNN is able to produce more detailed and accurate segmentation maps compared to traditional CNNs. The model has demonstrated promising results on various semantic segmentation datasets, especially for objects with complex shapes and fine-grained details.
In summary, Gated-SCNN is a semantic segmentation model that utilizes shape-aware gated convolution layers to capture fine-grained shape information and produce accurate segmentation results.",Gated-SCNN,24.8
CV,Computer vision engineer,32.5K,image segmentation,"YOLO is a real-time object detection system proposed by Joseph Redmon et al. It is known for its speed and accuracy in detecting objects in images and videos. Unlike traditional object detection methods that rely on region proposal algorithms, YOLO divides the input image into a grid and predicts bounding boxes and class probabilities directly from the grid cells. This approach allows YOLO to achieve real-time performance without sacrificing accuracy, making it popular in applications such as surveillance, autonomous driving, and augmented reality.",YOLO,24.8
CV,Computer vision engineer,32.5K,Multimodal,"GAN is a type of generative model introduced by Ian Goodfellow and his colleagues in 2014. It consists of two neural networks, the generator and the discriminator, which are trained simultaneously in a minimax game framework. The generator generates synthetic data samples, while the discriminator distinguishes between real and generated samples. Through adversarial training, GANs learn to generate highly realistic data samples that resemble the training data distribution. They have applications in image generation, image-to-image translation, and data augmentation.",GAN,35.4
CV,Computer vision engineer,32.5K,Multimodal,"FusionNet is a deep learning model that specializes in fusing different types of input data to produce accurate outputs. Specifically, it has been designed to leverage sparse LiDAR point clouds and RGB images to complete depth maps in computer vision tasks.
FusionNet utilizes the complementary information present in both LiDAR point clouds, which provide sparse but accurate depth measurements, and RGB images, which offer rich contextual information. By integrating these two modalities, FusionNet is able to produce more accurate and complete depth maps compared to using either modality alone.
The model typically consists of several convolutional layers and fusion modules that learn to extract features from both LiDAR and RGB data and then combine them effectively to generate the final depth map. FusionNet has been shown to achieve state-of-the-art performance on various depth completion benchmarks, demonstrating its effectiveness in fusing heterogeneous data sources.",FusionNet,35.4
RL,Reinforcement Learning Engineer,40.0K,Value based methods,"Q-learning is a reinforcement learning algorithm introduced by Christopher Watkins in 1989. It is used to learn the optimal action-selection policy for an agent in a Markov decision process (MDP) by iteratively updating a Q-value function. The Q-value represents the expected cumulative reward of taking a particular action in a given state and following the optimal policy thereafter. Through exploration and exploitation, Q-learning enables the agent to learn the optimal policy without knowledge of the MDP dynamics, making it suitable for solving a wide range of sequential decision-making problems.",Q-learning,40.2
RL,Reinforcement Learning Engineer,40.0K,Value based methods,"DQN is a variant of Q-learning introduced by DeepMind in 2013. It combines Q-learning with deep neural networks to approximate the Q-value function. By using deep neural networks to approximate Q-values, DQN can handle high-dimensional state spaces, such as raw pixel inputs from images. DQN also employs experience replay and target networks to stabilize training and improve sample efficiency. It has been successfully applied to various tasks, including playing Atari games from raw pixel inputs and mastering complex board games like Go.",DQN,40.2
RL,Reinforcement Learning Engineer,40.0K,Model automation,"Actor-Critic is a reinforcement learning architecture that combines elements of both value-based and policy-based methods. It consists of two neural networks: the actor, which learns a policy for selecting actions, and the critic, which learns the value function to evaluate the goodness of the actor's actions. The actor learns to maximize expected rewards by following the guidance of the critic's evaluations. Actor-Critic methods offer a balance between sample efficiency and stability, making them suitable for a wide range of continuous control tasks, robotics, and other applications where real-time decision-making is required.",Actor-Critic,21.3
RL,Reinforcement Learning Engineer,40.0K,Model automation,"Meta-Learning, also known as ""learning to learn"" or ""learning how to learn,"" refers to a subset of machine learning methods that aim to improve the learning process itself. Meta-learning techniques involve learning from multiple learning tasks and experiences to acquire knowledge that can be used to enhance the performance of future learning tasks.
The core idea behind meta-learning is to leverage past experience to guide the learning process in new situations. This is achieved by training a meta-learner that can identify commonalities and patterns in multiple learning tasks, and use this knowledge to generate or modify learning strategies for new tasks.
Meta-learning techniques have found applications in various domains, including reinforcement learning, few-shot learning, transfer learning, and hyperparameter optimization. For example, in few-shot learning, meta-learning algorithms can learn from a large number of related tasks with limited data to enable rapid adaptation to new tasks with only a few examples.
In summary, meta-learning focuses on improving the learning process by learning from past experience and using that knowledge to generate better learning strategies for new tasks.",Meta-Learning,21.3
Recommendation algorithm,Recommended Algorithm Engineer,35.6k,Collaborative filtering recommendation,User-User Collaborative Filtering is a recommendation technique based on the similarity between users. It works by identifying users who have similar preferences or behaviors and recommending items that these similar users have liked or interacted with.,User-User Collaborative Filtering,13.9
Recommendation algorithm,Recommended Algorithm Engineer,35.6k,Content based recommendation,"TF-IDF stands for Term Frequency-Inverse Document Frequency. It's a numerical statistic used to reflect the importance of a word in a document relative to a collection of documents, often used in natural language processing and information retrieval.",TF-IDF,51.4
